{
  "market": "tutoring",
  "role": "seller",
  "hosts": [
    "https://host-a.example"
  ],
  "openKey": "age1pq1zu32gez4dx85zqe8jfm0nl9dasm2nhxkgwdk543vzqs5a9zvcxt9q6kpg5s7k2cxh9qwnvartjcjgaqy0ahhdql94gwnxd3n8trhehkq8ppc52x0v5ndev6z566sy7ve3e0lrnq5vupdvst3j3mjdp73h7gxxvspmsf5p92l6efrudkf9r4thycx009dgsq2r07z8aac43t2c4zsgzxnj6e9gve4dlexhycwz044z4ep5xpg6vgzrjxpzuax9rt62fqdf7fqecwtr7z3cgdmc8hgl9ewgds2283gr9v8gpwr92pn268lr2elfs6u2xyfwmpct0jhgkwhage2ucvvwl752skpe8lz5zpy8cs9zud6rw5f03ktqlkwgp7ul4q0g4jzxvu29epxrqfw3q7q5gt8xmuxzk5evfqszvgx7dh949nq4f24p70j278lttdjpw7hu2qz7fd8grg9q0rfsd4eapadggmslddr5eh3vxs09n5suklhp7rttdfg9cgnsd6wjhzhajhgrxpewjjm6tzh4gtfwrgukp7h5tysxpr6hm9xrgwyxwesdz6qknpy856yzrlek0sjsehfkf4q644jd6s8t226qdfswrt5we2ftxqf2lz9cjarhkz9gmy867fnasg6qrysg89ps2saqy24zy44x32degus95zhdwvqc4rgyfue7gzq47u90twt8yqwm0geg885mafpp24nmqvywc8lepkynsvl85t46k6k95tjddt3jtueuxnchuur59227w04d96knqyhqd48jcs2uxn34wcpns70vrzrvtq9wackecv598duftc4eregtxkf4ydxrxtjzu2vnwljz26z8p6regjv9werhy963cfx3ntvs2jlatqag0dgl9p8n338zxecxudgd0y9tgdu8mgtekyh82m7aqecm7tfl4d8hu8npyutc2utxgwjpatn4msugpm9v5s8jvadufe5wgykq3e8d58x4rj5gq326zgkh77pdjsp6xpr2f7cxtkqpxjg6tpam63vwxrkt2ghqrm8r2d5ty6h5eck9gwmqlxnya2q75gjzu7rswuzehax92nuc7wls334wc5w9f94fjmergzsqmq8j4q4qw7z5davkz6f5f5ej326nwhrwymv6ggfvlgv3uuuzyfdawdcfsw87eec5drmng36gyn89zje0ydlmq9qnsugqryds84dc6tyzwczzfuehsf68nuewe07v32zjgyw38eppyqmxmr2hppjr9w8egm2pzjz9y3nvpt2245nsy9jyfwrk6qck4pfdat0fs3axp6t8za6v4jplynncg4skd0jq289cu4yvfjkgknr87uvtxdzt3czxx4w26qkktjf3x4rzc2zd3zfupafvryc85uxs4z6cfc3xws5nk228jnuqc8prlmpsu4p6uwpwvyh94qm8wa53wuxyyapfdh8yqr2wxnr60yqclgp3fpsxcufqpur032uw9vptheuc80dnx53zpfp5d5fh3nje7zzx93tksc7ql9p0ydjyw6t38t7hjh2s9e0rnqcj6umpc7seu703zhrmqfl8d673yyv6xj68le82ya943h0lfym58du7ucu8mzpgv23txu4xqx98k2fnq5mzngx330v8gnjlyfmgar8f8mgh3p7j9qdnggpdeea2lsvz2q68qn5dfn35q6aws7qrt6v9xj80k73hw5hequrxf57ac28ack3rvu0e9dhfwq249shmf9y8xqypt66wysxyvkuxz66g7jtuyarz44h5nrstfpeng9t423zsnknzx6w9wz6mfvpxgmldfg2uzac2kkucsrp49l6dtm7latw7ull0xtv6plvzsdhkldmplngzg6ykn77ut5x3sgxfuvy7qmv3rlaf4d3rtzscv95g0mknqzp8l90fhmcnq2yvn3ezfzqvs8fygrp",
  "pay": {
    "solana": "FpNMTKw7X43vUsn4hWiVaR5ffwSReu9eER7QLyQTE6jS",
    "evm": "0x2EFB4A3FE5DB14b089873445d9410e8651a9011B"
  },
  "keys": [
    {
      "key": "Ghq1ddwxcAziWDWjMnJFJX7ZdV4RKswLxuaHx6E65qJf",
      "open": "age1pq1j4pykuczqxkaszlpc0q6p53pmhscj55jjusu8s9jkv0m5vwgczgvemzh98lp990njayr7a7taqm6a42utqrsh0eg2600c0ps205qdykk9e365ydqg3ppe722mdueg5k9vuycxyplkvq5dp4mnee26a85pgdkdjdz9gccsgjr97v24gfec7rmv0x0ns7nd3gevldqwfd2y755h2ak9fcgdjpsyyzksxthv8lvcudnyucdy7fqs6cssa95krd65m3adz747438sa2u8ayuwh4kwfh7dw6fzd5w90trsn8kqs04ddlyz58cj6m6em7vpjt99shts5pahytjva2uzx4gme5es0h2ezq762da6nypngnh7n34ze5sk4yu8xrnaw5qu2z6tcqxsey0xzm2k5zm5j5dpp4kgs0k080rez5qjaerm2296anj3c6qv7d0gh2s7ecsyygazmqj90chqgx6jcz0rzueqx5emk9nxzdmsfr6z89e6gkrdks9q5nrkslz9nv5evumjr9u2pc2r0ztm0nv3fpsr9f0l2008e45ylg6ur5ftxc4z999u7v8v7nns2yucemq9n84ys5dj3gyhukza4r8pa9g32ydsgzrrv3h39f6fznv94y68uaen8deckr8pjtj9p9glyyuhgqc0n96n3srlvd3xda3qrhsvp50yqypklq6s6fl67ktg77pkpp2vlvvqpt3kcr96rm2qumv0ag4tnea6fgm93r6j39xh85zn527g306kty7l9plg9tx4kknqwrv5t6gnf8vcst47c9s42zzp4cmdwsac9n0jyg52xy30ws5vhpu0dwgk3jh2ff4d54rr6u22v27scvkwd5utzr4dmpkhs58gv6sprru7yxxrlpzfwqfnrwygdm4w6jlcy0nwgvxw5jrapjny8nlva8zsjsq39a54mnpn9a48p3nsacysu02ywaadr4qjsq2y7w3f348dpq7j7krxnerczanv2zlf0zjyyf2nkdc85nu0nynhc0akg8h8dyzfwv7yrj6qgjptu9pxa5hcx59q4fkdvgyf3dnq5u7g0z075ff64k0xyw25sky863ezdsh63fk02e8k9vyajkehqfqg5snju5z2kqfmg2rplrg8qqlt97fy7c3u7gvxeyus6uf3vq6g8wjmgzpshp5wdkqevqqp3u5y7sr7qqk7jttt03k59yvf3pw24ehu66tw3dmrkg4ncwvy9w9yu9uszuq49qclpzuvudn4503s5gshqgsn7e0yeq3nwatn6h5k6w4xyms3vmlju7relgk2kdmtddl33ktkqm5xj5fnylcp9cvz8cp7ectfd90wu5f63r3s70kvkd6tvwalx26f0rkzx0gkrum23hfudxvscqztje5ru6nk0q4gvq8v5lrw6tujtvze8xyczjkgx00gataq75k83sxy68m9fgfd82lgp8xgcfc5agz3ef8e0rzkvneyaa2l2alpjt240lt8lu6e8mhqgcsj7sagdzyazlmqdfyxwz9q0q4uvqmjyxqf6h2xtgygf6wyckyqjvruvrpmjz2rlgzr2ueg5ms0udxd4nmwdq8zrq0xdm3q72xjw2n50vgnn0x4k8rv69gay6lggm7zx9ukwechsu9h8xjs68savm369yh204jjda348nugera3eup9sfsxj93fkudgsst835sldd58cvyqmete05e8rgswef4fxdlyhg534w3n87l8tyjz2hv0dyclln555rqxphe5cjauzs37gwpg8wyp53u4efgyavx8xdzrve3h2shnh8frf48fr22tdjdvwyn0agxvvcy0xwrf3k9u4xjf2f0tr4pk5np8gm6h55erxcar402vs5pj04qef9auekjyy9t2epj7td34sl78pzy7eyw0xls3thvppy9784cw9muefs59qyvw5432u4uvdk4",
      "can": [
        "read",
        "write"
      ]
    }
  ],
  "proofs": [
    {
      "circuit": "reputation",
      "index": "4bQDpBgvr2V6K17nxuyXQREka3hzHuFCTnR2ieKRtqrz",
      "root": "18619871728f6ad817776768645b0878bf80bf19042cadd802b36e8b85fd0c3d",
      "time": 1790812800000,
      "signature": "tSWJzxuKrAlyv4WyvnL8Y2QdRp07bOaBxz6WdVHQMyOpWAuySWVlqa09AxRwHr-2q7HZ02DxU2tXYZjURk8VBQ",
      "score": 85,
      "proof": "Kgsg-t-53xplHOmR7ksd9yCaVTjb69Q85d8AqdrDGrcskR86AmUF0mbp9_YHRt7cwSPMtbHxQk6lOqGGWqF_gQFtKYGXN_NK885q0fl223MkDf_LkVKxuH1kBomzZdjkDFyJ9eWKTNke78z78hRLAnVxIhAaQIIDtukRMEcxkFMo9faXM051-4DK_J25-PzqWHgeWIGCkx6Rx8yXojfg5CT323hgnmqqsrNdOONKsMabEM2cxFwDQsjFmLRabscSJOes-YA02pWWeCkas9xNzf6J3yzsAYxqG2AAIQRMihYk9yBsgx58Qgts5fj4OZxFpraqRzXcaSowqORNnewdeQ"
    },
    {
      "circuit": "verification",
      "verifier": "EyQqRjUNPJBrsaFccnJoWttytrsUZeoF26bCiS6BXs7G",
      "verifierName": "verifier-a.example",
      "label": "tutoring/seller",
      "proof": "Bdt_QHhVLkRpz6zqI4NTCprKmTJ6SexlMh65a2wMk6gid2Ho-e-A3E4kmRu-CWTKFFhiHejyfNCpTq9YdjNZpi0_gZmaAdQvQei44iGYIpGSxPZj2tH-N-rNOCeyO_WJKtVp0ps3IeMkW5WjCvjt9XexIt1sPLUPj7ny2as9s2YEFXgmN8Kc9ZMhu387rN8tCttX6EOUcEpmMhA8Yop4JBhWOCQq5z9nBoVHR4aIdSJmdcuGykR2DCA7SwTAjAvdDaRx-etv1L2Q1TPQlQBO8iA7oo3xADylKFuGZNA5HrEFB3j72Ew4AKnR1WcV2ROYN--BfexRyOK4wl1MZMJbXA"
    }
  ]
}
